{
  "case_id": "tcpdump-4.9.1-cve-2017-13031",
  "target": {
    "project": "tcpdump",
    "version": "4.9.1",
    "source_root": "/home/li/skillclaw-eval/tcpdump-4.9.1",
    "binary": "tcpdump",
    "build": "Built from source on the remote VM; target binary has debug_info and is not stripped."
  },
  "ground_truth": {
    "cves": [
      "CVE-2017-13031"
    ],
    "files": [
      "print-frag6.c"
    ],
    "functions": [
      "frag6_print"
    ],
    "vulnerability_type": "buffer over-read / insufficient bounds check",
    "root_cause": "IPv6 fragment header printer checks an insufficient field range before later reading the fragment identification field",
    "required_evidence": [
      "frag6_print",
      "ND_TCHECK",
      "ip6f_offlg",
      "ip6f_ident"
    ],
    "references": [
      {
        "label": "NVD CVE-2017-13031",
        "url": "https://nvd.nist.gov/vuln/detail/CVE-2017-13031"
      },
      {
        "label": "tcpdump upstream repository",
        "url": "https://github.com/the-tcpdump-group/tcpdump"
      }
    ]
  },
  "validators": [
    {
      "name": "agent-output-ground-truth-match",
      "type": "content_match",
      "source": "agent_output",
      "use_ground_truth": true,
      "match": "any",
      "allow_failure": true
    },
    {
      "name": "ground-truth-source-location",
      "type": "source_contains",
      "file": "print-frag6.c",
      "patterns": [
        "frag6_print",
        "ND_TCHECK",
        "ip6f_offlg",
        "ip6f_ident"
      ]
    },
    {
      "name": "binary-present",
      "type": "command",
      "command": "file tcpdump && readelf -h tcpdump | head -20",
      "timeout_seconds": 20,
      "allow_failure": true
    },
    {
      "name": "pcap-poc-placeholder",
      "type": "asan_command",
      "enabled": false,
      "command": "ASAN_OPTIONS=abort_on_error=1 ./tcpdump -n -vv -r poc-cve-2017-13031.pcap",
      "timeout_seconds": 20,
      "note": "Enable after adding a stable CVE-2017-13031 pcap PoC and ASan build."
    }
  ],
  "scoring": {
    "max_score": 10,
    "weights": {
      "cve": 2,
      "file": 2,
      "function": 3,
      "root_cause": 2,
      "evidence": 1
    }
  },
  "prompt": {
    "recommended_skillclaw": "Do not use WebSearch. The current working directory is tcpdump-4.9.1 and the target program is ./tcpdump. Use SkillClaw server-side skills to locate a known buffer over-read vulnerability related to the IPv6 fragmentation header parser. Do not invoke Claude Code local Skill(...). Analyze source code and build artifacts. Finish with a single JSON object containing predicted_cves, predicted_files, predicted_functions, root_cause, evidence, and confidence.",
    "recommended_direct": "Do not use WebSearch. Do not use any skill. The current working directory is tcpdump-4.9.1 and the target program is ./tcpdump. Locate a known buffer over-read vulnerability related to the IPv6 fragmentation header parser. Analyze source code and build artifacts. Finish with a single JSON object containing predicted_cves, predicted_files, predicted_functions, root_cause, evidence, and confidence."
  },
  "notes": "Targeted case. Prior results show both SkillClaw and direct DeepSeek can localize print-frag6.c:frag6_print, but SkillClaw once hallucinated a wrong CVE id in the summary."
}
